{
  "schema": "rubric/1",
  "role": "pr-review",
  "intent": "review-change",
  "version": 1,
  "criteria": [
    {
      "id": "PR-1",
      "statement": "The change does what its issue asks, and nothing the issue does not ask.",
      "category": "requirements",
      "evidence": "The acceptance contract, or the issue where there is none.",
      "severity_if_violated": "major"
    },
    {
      "id": "PR-2",
      "statement": "No code path writes outside what the Role's permitted Effects allow.",
      "category": "security",
      "evidence": "The diff.",
      "severity_if_violated": "blocking"
    },
    {
      "id": "PR-3",
      "statement": "The change does what it means to, with no logic error, and new behaviour has a test that would fail without it.",
      "category": "functional",
      "evidence": "The diff.",
      "severity_if_violated": "major",
      "applies_when": {
        "paths": [
          "**/*.py"
        ]
      }
    },
    {
      "id": "PR-4",
      "statement": "Nothing under kernel/ performs I/O or reads the clock.",
      "category": "architecture",
      "evidence": "The purity check, and the diff.",
      "severity_if_violated": "blocking",
      "applies_when": {
        "paths": [
          "kernel/**"
        ]
      }
    },
    {
      "id": "PR-5",
      "statement": "A rule that is new, or that has stopped waiting, names a test that would fail if the rule were broken. A file that merely exists is not a check.",
      "category": "requirements",
      "evidence": "The diff, and the test the rule names.",
      "severity_if_violated": "major",
      "applies_when": {
        "paths": [
          "AGENTS.md",
          "**/AGENTS.md",
          "docs/**"
        ]
      }
    }
  ]
}
